{
  "schema_version": "1.0.0",
  "record_type": "longitudinal-series",
  "system_id": "my-ai-system",
  "measure_id": "M-003",
  "target": 5.0,
  "comparison": "LE",
  "data_points": [
    {
      "timestamp": "2025-09-01T00:00:00Z",
      "system_version": "1.0.0",
      "value": 12.5,
      "n": 200,
      "notes": "Initial baseline measurement"
    },
    {
      "timestamp": "2025-11-01T00:00:00Z",
      "system_version": "1.1.0",
      "value": 6.3,
      "n": 350,
      "notes": "After provenance tracking added"
    },
    {
      "timestamp": "2026-01-15T00:00:00Z",
      "system_version": "1.2.0",
      "value": 2.1,
      "n": 500,
      "notes": "After knowledge graph enrichment"
    }
  ],
  "notes": "Tracks hallucination rate reduction across three major versions."
}
